{
  "id": "2026-10-13-okie-tex-2026",
  "program": "Messier",
  "date": "2026-10-13",
  "site": { "name": "Okie-Tex 2026", "lat": 36.898, "lon": -102.952 },
  "sky": { "sqm": 21.99 },
  "scope": {
    "name": "Orion XT8",
    "type": "Dobsonian",
    "aperture_mm": 203,
    "focal_length_mm": 1200,
    "f_ratio": 5.9
  },
  "observers": ["Kacy Luker"],
  "notebook": "astronomy-001",
  "pages": [6],
  "observations": [
    {
      "catalog_id": "M27",
      "aka": "Dumbbell Nebula",
      "ids": ["M27", "NGC 6853"],
      "page": 6,
      "local_time": "23:30",
      "seeing": 2,
      "transparency": 3,
      "eyepiece": "13mm Ethos",
      "filter": "N/A",
      "description": "Faint; most background stars are brighter; halo and core are very similar brightness; halo is round; core is like a rounded hourglass"
    }
  ]
}
